ID,Type,SKU,Name,Published,Is featured?,Visibility in catalog,Short description,Description,Tax status,Tax class,In stock?,Stock,Backorders allowed?,Sold individually?,Regular price,Sale price,Categories,Tags,Images,Gallery,Download limit,Download expiry days,Parent,Grouped products,Attributes,Default attributes,Brands
,,PR1CS450,ANTENA TELTONIKA MOVIL COMPACTA,,,,,,,,,6.0,,,8.82,,Otros,"teltonika, movil, compacta, antena",https://starcenter.com.uy/uploads/products/2590-1775961437.png,,,,,,,,Sin Marca
,,PR2AM20M,FUENTE DE ALIMENTACION TELTONIKA PARA AUTO,,,,"Este adaptador de alimentación DC está diseñado para ofrecer una conversión de voltaje confiable y segura, adecuado para una amplia variedad de dispos...","Este adaptador de alimentación DC está diseñado para ofrecer una conversión de voltaje confiable y segura, adecuado para una amplia variedad de dispositivos electrónicos.

Características principales:

Voltaje de Entrada: 9 – 30 VDC
Conector de Entrada: Salida de energía auxiliar de 12 / 24 VDC
Conector de Salida: 4 pines, paso de 3 mm
Corriente Máxima: 2 A
Protección de Entrada: Fusible, para mayor seguridad y protección del dispositivo
Cable: 2 x 0.2 mm² (2 x 24 AWG)
Indicador LED: Sí, para monitoreo del estado de funcionamiento
Cumplimiento RoHS: Sí


Este adaptador es ideal para aplicaciones que requieren una fuente de alimentación versátil y segura. El rango de voltaje de entrada de 9 a 30 VDC y el conector de entrada para salidas de energía auxiliares de 12 / 24 VDC aseguran una amplia compatibilidad con diferentes fuentes de energía. El conector de salida de 4 pines con paso de 3 mm proporciona una conexión estable y segura para los dispositivos alimentados. Además, la protección por fusible integrada garantiza la seguridad y durabilidad del adaptador, mientras que el indicador LED permite un fácil monitoreo del estado operativo. Este producto cumple con las normativas RoHS, asegurando su conformidad con los estándares ambientales y de seguridad.",,,,3.0,,,12.74,,Cables,"producto, 24, x, requieren, teltonika, y, /, adaptador,, confiable, 12, a, cumplimiento, electrónicos., variedad, rango, conformidad, el, es, que, entrada:, proporciona, seguridad., con, operativo., energía., segura,, características, fuente, 30, 4, durabilidad, versátil, mm, auxiliares, protección, ambientales, auxiliar, salida, amplia, fuentes, estable, ideal, conexión, para, la, estándares, energía, aplicaciones, permite, adecuado, pines,, mm², 2, entrada, compatibilidad, su, alimentacion, monitoreo, por, diseñado, de, alimentación, los, normativas, auto, corriente, ofrecer, paso, integrada, led:, rohs:, salidas, conversión, seguridad, funcionamiento, fusible, garantiza, cumple, principales:, dc, una, (2, diferentes, segura, además,, este, vdc, del, 3, dispositivos, mayor, fácil, asegurando, led, dispositivo, está, salida:, 9, sí,, rohs,, 0.2, un, voltaje, máxima:, –, cable:, conector, sí, aseguran, pines, estado, adaptador, indicador, mientras, alimentados., awg), fusible,, segura., las",https://starcenter.com.uy/uploads/products/2593-1542016435.png,,,,,,,,Sin Marca
,,PR5MEC11,KIT DE RAIL DIN COMPACTO,,,,,,,,,10.0,,,7.84,,Otros,"compacto, de, kit, din, rail",https://starcenter.com.uy/uploads/products/2594-1052165164.png,,,,,,,,Sin Marca
,,RUT300,ROUTER TELTONIKA RUT300  5 X ETH 10 / 100  (1 X WAN),,,,"Pequeño y poderoso router Ethernet perfecto para tareas exigentes de red insdustrial como para aplicaciones de red generales.
Cinco puertos Ethernet, ...","Pequeño y poderoso router Ethernet perfecto para tareas exigentes de red insdustrial como para aplicaciones de red generales.
Cinco puertos Ethernet, dos puertos digitales I/O configurables, y un puerto USB para conectar fácilmente varios equipos a internet.
Firewal pre configurado para lograr seguridad inmediata y multiples de las más utilzadas VPNs 
POE pasivo ayuda a reducir complejidades de implementación.
Económico pero rico en capacidades, con todos los beneficios de RutOS and Remote Management System (RMS).",,,,2.0,,,129.36,,Otros,"vpns, en, rut300, lograr, insdustrial, ethernet,, equipos, puerto, x, firewal, los, de, varios, teltonika, usb, y, /, pero, 5, red, un, a, inmediata, pasivo, router, rutos, generales., (rms)., conectar, i/o, multiples, pequeño, pre, seguridad, ethernet, utilzadas, ayuda, tareas, and, más, internet., como, todos, 10, para, implementación., system, remote, management, reducir, configurables,, aplicaciones, perfecto, configurado, 100, económico, exigentes, poe, capacidades,, dos, cinco, poderoso, digitales, con, (1, wan), fácilmente, beneficios, complejidades, rico, puertos, las, eth",https://starcenter.com.uy/uploads/products/2596-31500846.jpg,,,,,,,,Sin Marca
,,811124,AFEITADORA BIC HOJA DOBLE BX/100,,,,,,,,,8109.0,,,26.3,,Otros,"bx/100, afeitadora, bic, hoja, doble",https://starcenter.com.uy/uploads/products/2603-1398967304.jpg,,,,,,,,Sin Marca
,,835205,BOLÍGRAFO BIC CRISTAL MEDIANO AZUL BOX X50U,,,,,,,,,1803.0,,,17.81,,Otros,"mediano, x50u, bic, cristal, box, azul, bolígrafo",https://starcenter.com.uy/uploads/products/2604-533553316.jpg,,,,,,,,Sin Marca
,,8713191,AFEITADORA BIC COMFORT 3 ADVANCE SENSITIVE BLISTER X2U,,,,,,,,,12046.0,,,3.28,,Otros,"advance, 3, afeitadora, bic, comfort, blister, x2u, sensitive",https://starcenter.com.uy/uploads/products/2608-1508369304.jpg,,,,,,,,Sin Marca
,,876510,AFEITADORA BIC SENSITIVE BS/2,,,,,,,,,67284.0,,,0.78,,Otros,"bs/2, sensitive, afeitadora, bic",https://starcenter.com.uy/uploads/products/2609-1512020338.jpg,,,,,,,,Sin Marca
,,9298491,AFEITADORA BIC COMFORT 3 ADVANCE NORMAL BLISTER X4U,,,,,,,,,7980.0,,,4.92,,Otros,"advance, 3, afeitadora, bic, comfort, normal, blister, x4u",https://starcenter.com.uy/uploads/products/2610-1582364021.jpg,,,,,,,,Sin Marca
,,9298501,AFEITADORA BIC COMFORT 3 ADVANCE SENSITIVE BLISTER X4U,,,,,,,,,9534.0,,,4.92,,Otros,"advance, 3, afeitadora, bic, comfort, blister, x4u, sensitive",https://starcenter.com.uy/uploads/products/2611-1500156434.jpg,,,,,,,,Sin Marca
,,904197,RESALTADOR BIC ROSA BLISTER X1U,,,,,,,,,3330.0,,,1.05,,Otros,"x1u, rosa, bic, blister, resaltador",https://starcenter.com.uy/uploads/products/2618-1408279942.jpg,,,,,,,,Sin Marca
,,904396,RESALTADOR BIC AMARILLO BOX X12U,,,,,,,,,288.0,,,7.81,,Otros,"bic, resaltador, amarillo, box, x12u",https://starcenter.com.uy/uploads/products/2620-169397962.jpg,,,,,,,,Sin Marca
,,904399,RESALTADOR BIC VERDE BOX X12U,,,,,,,,,50.0,,,7.81,,Otros,"verde, bic, resaltador, box, x12u",https://starcenter.com.uy/uploads/products/2621-1249817606.jpg,,,,,,,,Sin Marca
,,930810,PEGAMENTO LIQUIDO BIC BLANCO 90GR BOX X12U,,,,,,,,,3815.0,,,15.86,,Otros,"blanco, 90gr, bic, liquido, pegamento, box, x12u",https://starcenter.com.uy/uploads/products/2623-590925064.png,,,,,,,,Sin Marca
,,930811,PEGAMENTO LIQUIDO BIC BLANCO 40GR BOX X12U,,,,,,,,,7119.0,,,8.66,,Otros,"blanco, bic, 40gr, liquido, pegamento, box, x12u",https://starcenter.com.uy/uploads/products/2624-1766218794.jpg,,,,,,,,Sin Marca
,,968594,MICROFIBRA BIC INTENSITY NEGRA BOX X10U,,,,,,,,,448.0,,,8.88,,Otros,"x10u, microfibra, bic, intensity, negra, box",https://starcenter.com.uy/uploads/products/2628-1602671862.jpg,,,,,,,,Sin Marca
,,904397,RESALTADOR BIC ROSA BOX X12U,,,,,,,,,702.0,,,7.81,,Otros,"rosa, bic, resaltador, box, x12u",https://starcenter.com.uy/uploads/products/2635-545720881.jpg,,,,,,,,Sin Marca
,,BT6001BK,BOTELLA DE TINTA BROTHER NEGRO BT6001,,,,,,,,,131.0,,,11.76,,Otros,"brother, tinta, botella, negro, de, bt6001",https://starcenter.com.uy/uploads/products/2660-1448995233.jpg,,,,,,,,Sin Marca
,,AS6504RS,NAS ASUSTOR AS6504RS 4 BAHIAS 8GB DDR4,,,,"NAS Asustor AS6504RS
CPU Intel Atom C3538 de cuatro núcleos a 2,1 GHz
Memoria 8 GB DDR4-2133 expandible hasta 128 GB.
Ethernet:Gigabit Ethernet (1G/10...","NAS Asustor AS6504RS
CPU Intel Atom C3538 de cuatro núcleos a 2,1 GHz
Memoria 8 GB DDR4-2133 expandible hasta 128 GB.
Ethernet:Gigabit Ethernet (1G/100M) x 2; 2.5 Gigabit Ethernet (2.5G/1G/100M) x 2

Soporta hasta 4 x SATA3 6Gb/s 3.5""/2.5"" HDD/SSD 
Formato rackeable 1U, INCLUYE kit de rack
Tipo de volumen: Single, JBOD, RAID 0, RAID 1, RAID 5, RAID 6, RAID 10
Admite Wake-on-LAN y Wake-on-WAN
Compatibilidad completa con iSCSI/IP-SAN y NFS - Compatible con VMware, Citrix e Hyper-V - Compatible con máquinas virtuales y aplicaciones Docker
Admite ACL y AD.
Ranura PCIe para tarjetas 10 Gigabit Ethernet (opcional).
Protocolos de red
CIFS / SMB, SMB 2.0 / 3.0, AFP, NFS, FTP (Compatibilidad con Unicode), TFTP, WebDAV, Rsync, SSH, SFTP, iSCSI/IP-SAN, HTTP, HTTPS, Proxy, SNMP, Syslog
Conexiones cifradas: HTTPS, FTP sobre SSL/TLS, SSH, SFTP, Rsync sobre SSH",,,,2.0,,,1333.78,,Otros,"3.0,, ssh,, x, tipo, y, /, a, gb, wake-on-lan, hdd/ssd, tarjetas, iscsi/ip-san, pcie, protocolos, ftp, rsync, acl, docker, expandible, 3.5""/2.5"", conexiones, con, cuatro, ssl/tls,, núcleos, 4, 8, ddr4-2133, (opcional)., http,, nas, smb,, compatible, smb, ethernet:gigabit, 128, rack, hasta, gigabit, 8gb, para, asustor, 6,, (compatibilidad, aplicaciones, 2.5, iscsi/ip-san,, rackeable, 2, kit, 0,, raid, cifradas:, as6504rs, proxy,, sftp,, compatibilidad, unicode),, cpu, de, admite, memoria, red, incluye, completa, 1,, gb., nfs, volumen:, nfs,, máquinas, formato, webdav,, sobre, intel, cifs, virtuales, 2;, 6gb/s, wake-on-wan, bahias, ddr4, rsync,, (1g/100m), e, atom, ssh, vmware,, snmp,, syslog, soporta, 5,, 2.0, single,, -, ethernet, 1u,, 10, ranura, https,, citrix, afp,, jbod,, 2,1, tftp,, ghz, ad., hyper-v, (2.5g/1g/100m), sata3, c3538","https://starcenter.com.uy/uploads/products/2669-1198475362.png, https://starcenter.com.uy/uploads/products/2669-1866330603.png, https://starcenter.com.uy/uploads/products/2669-459666121.png, https://starcenter.com.uy/uploads/products/2669-1682714898.png, https://starcenter.com.uy/uploads/products/2669-769111090.png, https://starcenter.com.uy/uploads/products/2669-214583774.png, https://starcenter.com.uy/uploads/products/2669-1866330603.png, https://starcenter.com.uy/uploads/products/2669-459666121.png, https://starcenter.com.uy/uploads/products/2669-1682714898.png, https://starcenter.com.uy/uploads/products/2669-769111090.png, https://starcenter.com.uy/uploads/products/2669-214583774.png","https://starcenter.com.uy/uploads/products/2669-1866330603.png, https://starcenter.com.uy/uploads/products/2669-459666121.png, https://starcenter.com.uy/uploads/products/2669-1682714898.png, https://starcenter.com.uy/uploads/products/2669-769111090.png, https://starcenter.com.uy/uploads/products/2669-214583774.png",,,,,,,Sin Marca
,,EN46171,GABINETE XIGMATEK VORTEX,,,,"• Elegante panel frontal con rayas RGB y vidrio templado en el lateral izquierdo
• Diseño de chasis de ventilación y flujo de aire superior
• Colocaci...","• Elegante panel frontal con rayas RGB y vidrio templado en el lateral izquierdo
• Diseño de chasis de ventilación y flujo de aire superior
• Colocación de varios ventiladores de refrigeración de hasta 5 x 120 mm
• Compatibilidad con radiadores de refrigeración líquida: traseros de 120 mm
• Espacio libre del enfriador de la CPU 160 mm
• Limitación de longitud VGA 290 mm
• Fácil gestión de cables",,,,105.0,,,32.34,,Cables,"libre, vortex, compatibilidad, limitación, frontal, en, gabinete, diseño, vga, cpu, x, espacio, traseros, mm, de, varios, y, 5, izquierdo, rayas, cables, hasta, aire, enfriador, •, ventiladores, elegante, el, 290, templado, radiadores, rgb, superior, la, vidrio, chasis, ventilación, del, 160, colocación, líquida:, fácil, gestión, con, longitud, panel, 120, lateral, refrigeración, xigmatek, flujo","https://starcenter.com.uy/uploads/products/2678-1936192511.jpg, https://starcenter.com.uy/uploads/products/2678-530188802.jpg, https://starcenter.com.uy/uploads/products/2678-315616166.jpg, https://starcenter.com.uy/uploads/products/2678-898101451.jpg, https://starcenter.com.uy/uploads/products/2678-2123556731.jpg, https://starcenter.com.uy/uploads/products/2678-844939415.jpg, https://starcenter.com.uy/uploads/products/2678-530188802.jpg, https://starcenter.com.uy/uploads/products/2678-315616166.jpg, https://starcenter.com.uy/uploads/products/2678-898101451.jpg, https://starcenter.com.uy/uploads/products/2678-2123556731.jpg, https://starcenter.com.uy/uploads/products/2678-844939415.jpg","https://starcenter.com.uy/uploads/products/2678-530188802.jpg, https://starcenter.com.uy/uploads/products/2678-315616166.jpg, https://starcenter.com.uy/uploads/products/2678-898101451.jpg, https://starcenter.com.uy/uploads/products/2678-2123556731.jpg, https://starcenter.com.uy/uploads/products/2678-844939415.jpg",,,,,,,Sin Marca
,,EN47109,FUENTE XIGMATEK MINOTAUR 1000W,,,,"Lider mundial en la industria de PC para Xigmatek Co. Ltd. Xigmatek provee thermal cooling, chasis, fuentes de alimentación y accesorios para PC.","Lider mundial en la industria de PC para Xigmatek Co. Ltd. Xigmatek provee thermal cooling, chasis, fuentes de alimentación y accesorios para PC.",,,,3.0,,,176.4,,Otros,"fuente, en, mundial, ltd., provee, de, alimentación, y, minotaur, 1000w, pc., fuentes, accesorios, para, la, chasis,, cooling,, pc, thermal, lider, co., industria, xigmatek",https://starcenter.com.uy/uploads/products/2679-285208202.jpg,,,,,,,,Sin Marca
,,WS7100-30,ROUTER HUAWEI WIFI AX3(DUAL-CORE)WHITE,,,,"El router Huawei AX3 - WS7100 - Dual-Core vas a poder establecer redes potentes para enviar y recibir información a gran velocidad.
Más antenas, mejor...","El router Huawei AX3 - WS7100 - Dual-Core vas a poder establecer redes potentes para enviar y recibir información a gran velocidad.
Más antenas, mejor señal
Con este dispositivo, las paredes y techos no son un obstáculo: los múltiples receptores garantizan un mejor rendimiento en lugares con gran nivel de interferencia.

ESPECIFICACIONES
PUERTOS:
- WAN: 1 puerto Ethernet 10/100 Mbps
- LAN: 3 puertos Ethernet 10/100 Mbps
DIMENSIONES: 39.7 mm x 225 mm x 159.2 mm
ELECTRICIDAD: 12V/1A
ESTÁNDAR: 802.11ax/n/b/g 2.4GHz
ANTENAS: 4 externas
SEGURIDAD: DMZ.WPA3

 
 
  
",,,,151.0,,,44.1,,Otros,"no, 4, seguridad:, en, gran, dual-core, especificaciones, puerto, lugares, x, externas, los, de, mm, nivel, velocidad., y, 1, dispositivo,, un, señal, a, establecer, 159.2, electricidad:, router, receptores, wan:, interferencia., ws7100, 10/100, -, antenas,, dimensiones:, mbps, puertos:, enviar, ethernet, mejor, huawei, paredes, 12v/1a, el, 225, recibir, techos, más, redes, 39.7, para, este, poder, ax3, rendimiento, garantizan, potentes, son, 3, lan:, información, ax3(dual-core)white, wifi, obstáculo:, 802.11ax/n/b/g, con, múltiples, 2.4ghz, dmz.wpa3, estándar:, antenas:, vas, puertos, las","https://starcenter.com.uy/uploads/products/2684-490685600.png, https://starcenter.com.uy/uploads/products/2684-752059762.png, https://starcenter.com.uy/uploads/products/2684-1761266015.png, https://starcenter.com.uy/uploads/products/2684-925217862.png, https://starcenter.com.uy/uploads/products/2684-61097703.png, https://starcenter.com.uy/uploads/products/2684-752059762.png, https://starcenter.com.uy/uploads/products/2684-1761266015.png, https://starcenter.com.uy/uploads/products/2684-925217862.png, https://starcenter.com.uy/uploads/products/2684-61097703.png","https://starcenter.com.uy/uploads/products/2684-752059762.png, https://starcenter.com.uy/uploads/products/2684-1761266015.png, https://starcenter.com.uy/uploads/products/2684-925217862.png, https://starcenter.com.uy/uploads/products/2684-61097703.png",,,,,,,Sin Marca
,,ARGHS5050P,AURICULARES BLUETOOTH SKEIPODS E50 PINK ARGOM,,,,Nuevos auriculares estéreo inalámbricos verdaderos: SkeiPods E50. Ahora puedes llevar tu audio sobre la marcha con estos botones de audio de alta defi...,"Nuevos auriculares estéreo inalámbricos verdaderos: SkeiPods E50. Ahora puedes llevar tu audio sobre la marcha con estos botones de audio de alta definición. Diseñado pensando en la movilidad; Viene con un elegante estuche de carga que proporciona hasta 15 horas adicionales. Esto significa que puede disfrutar de hasta 18 horas de audio mientras viaja. Para colmo, viene con magníficos accesorios como ganchos para las orejas, correa para el cuello y funda protectora de silicona (disponible en 3 colores) para el estuche de carga. Tecnología de emparejamiento automático para una configuración sin problemas y hasta 15 metros de rango operativo inalámbrico.",,,,6.0,,,27.44,,Otros,"carga, y, puedes, operativo, 18, elegante, rango, pensando, el, (disponible, funda, que, estos, disfrutar, proporciona, colmo,, con, alta, horas, botones, en, sin, colores), verdaderos:, hasta, estéreo, como, auriculares, skeipods, para, nuevos, la, viaja., automático, significa, cuello, adicionales., metros, emparejamiento, diseñado, de, problemas, e50, accesorios, una, puede, e50., estuche, pink, sobre, ahora, inalámbricos, movilidad;, 3, audio, argom, viene, carga., orejas,, configuración, tu, un, correa, protectora, silicona, magníficos, 15, bluetooth, marcha, mientras, ganchos, tecnología, llevar, esto, inalámbrico., las, definición.",https://starcenter.com.uy/uploads/products/2705-550631947.jpg,,,,,,,,Argom
,,ARGHS5050K,AURICULAR ARGOM SKEIPODS E50 BT / WHITE,,,,Nuevos auriculares estéreo inalámbricos verdaderos: SkeiPods E50. Ahora puedes llevar tu audio sobre la marcha con estos botones de audio de alta defi...,"Nuevos auriculares estéreo inalámbricos verdaderos: SkeiPods E50. Ahora puedes llevar tu audio sobre la marcha con estos botones de audio de alta definición. Diseñado pensando en la movilidad; Viene con un elegante estuche de carga que proporciona hasta 15 horas adicionales. Esto significa que puede disfrutar de hasta 18 horas de audio mientras viaja. Para colmo, viene con magníficos accesorios como ganchos para las orejas, correa para el cuello y funda protectora de silicona (disponible en 3 colores) para el estuche de carga. Tecnología de emparejamiento automático para una configuración sin problemas y hasta 15 metros de rango operativo inalámbrico.",,,,45.0,,,49.0,,Otros,"carga, /, y, puedes, operativo, 18, elegante, rango, pensando, el, (disponible, funda, que, estos, disfrutar, proporciona, colmo,, con, alta, horas, botones, en, sin, colores), verdaderos:, hasta, estéreo, white, como, auriculares, skeipods, para, nuevos, la, viaja., automático, significa, auricular, cuello, bt, adicionales., metros, emparejamiento, diseñado, de, problemas, e50, accesorios, una, puede, e50., estuche, sobre, ahora, inalámbricos, movilidad;, 3, audio, argom, viene, carga., orejas,, configuración, tu, un, correa, protectora, silicona, magníficos, 15, marcha, mientras, ganchos, tecnología, llevar, esto, inalámbrico., las, definición.",https://starcenter.com.uy/uploads/products/2706-129823178.jpg,,,,,,,,Argom
,,ARGKB1076,TECLADO NUMERICO RETRACTIL  ARGOM,,,,"Descripción
Perfecto para cualquier notebook o computadora, el teclado numérico USB ArgomTech con cable retráctil, permite a los usuarios ingresar dat...","Descripción
Perfecto para cualquier notebook o computadora, el teclado numérico USB ArgomTech con cable retráctil, permite a los usuarios ingresar datos numéricos de forma rápida y cómoda.

Especificaciones
Diseño compacto y ergonómico
Teclas receptivas, suaves y cómodas
Cable USB retráctil extensible hasta 31,5” (80 cm)
Plug & Play
Teclas extra duraderas
19 teclas, incluida la tecla de retroceso
Compatible con la mayoría de los sistemas operativos",,,,14.0,,,8.33,,Cables,"ergonómico, retroceso, o, notebook, diseño, &, especificaciones, plug, los, de, extra, usb, y, argomtech, compatible, a, compacto, (80, descripción, numerico, datos, numéricos, hasta, 19, ingresar, teclas,, usuarios, duraderas, incluida, tecla, numérico, el, teclado, cómoda., sistemas, play, cm), forma, para, computadora,, la, mayoría, rápida, perfecto, retractil, retráctil, operativos, cualquier, extensible, permite, con, retráctil,, argom, receptivas,, cable, 31,5”, cómodas, suaves, teclas",https://starcenter.com.uy/uploads/products/2733-1154706428.jpg,,,,,,,,Argom
,,ARGKB2051BK,COMBO TECLADO Y MOUSE GAMING KB51 ARGOM,,,,"Especificaciones
TECLADO: 
Diseño liviano
Rainbow Lighting
1.35m
Tamaño del cable USB : 431.7 x 126.5 x 26 mm
Peso: 392g

RATÓN:
800DPI
Diseño liviano...","Especificaciones
TECLADO: 
Diseño liviano
Rainbow Lighting
1.35m
Tamaño del cable USB : 431.7 x 126.5 x 26 mm
Peso: 392g

RATÓN:
800DPI
Diseño liviano
Rainbow Lighting
1.35m
Tamaño del cable USB : 120 x 71 x 30 mm
Peso: 104g",,,,21.0,,,16.66,,Cables,"30, rainbow, 126.5, 800dpi, diseño, especificaciones, 431.7, mouse, x, mm, combo, usb, ratón:, y, liviano, teclado:, kb51, :, 392g, gaming, 71, teclado, lighting, 26, tamaño, del, peso:, 1.35m, 104g, argom, 120, cable",https://starcenter.com.uy/uploads/products/2734-915029504.jpg,,,,,,,,Argom
,,FMB920,TRACKER TELTONIKA FMB920 GPRS / GNSS CAN DATA READING,,,,,,,,,2.0,,,33.32,,Otros,"can, reading, data, tracker, fmb920, gprs, gnss, teltonika, /",https://starcenter.com.uy/uploads/products/2749-1119670216.png,,,,,,,,Sin Marca
,,RUT360,ROUTER TELTONIKA RUT360 WIFI 1 X LTE CAT 6 -2 X ETH 10 / 100,,,,"Router industrial que permite conectarse a internet mediante la red cellular, WiFi y red cableada. Equipado con dos interfaces Ethernet, 802.11 b/g/n ...","Router industrial que permite conectarse a internet mediante la red cellular, WiFi y red cableada. Equipado con dos interfaces Ethernet, 802.11 b/g/n WiFi, y 4G LTE Cat 6, con velocidades hasta 300mbps. Perfecto para aplicaciones IoT y M2M, donde la comunicación segura y estable es una necesidad. Su capacidad de Carrier aggregation lo hace ideal en áreas o aplicaciones done las velocidades vía datos celulares son limitadas.",,,,1.0,,,251.86,,Cables,"cellular,, 300mbps., o, su, en, donde, ethernet,, x, rut360, de, wifi,, celulares, iot, 1, teltonika, /, y, red, mediante, cableada., a, done, router, cat, velocidades, m2m,, hace, hasta, datos, 4g, carrier, internet, comunicación, aggregation, equipado, estable, lo, una, ideal, -2, 10, segura, para, es, áreas, lte, que, limitadas., la, b/g/n, 6, son, 6,, aplicaciones, perfecto, wifi, 100, conectarse, dos, permite, con, vía, 802.11, necesidad., industrial, interfaces, capacidad, las, eth",https://starcenter.com.uy/uploads/products/2751-857953240.png,,,,,,,,Sin Marca
,,TRK-U12,KIT DE RACK TERRAMASTER,,,,Kit de rack para terramaster U4/U8/U12,Kit de rack para terramaster U4/U8/U12,,,,2.0,,,156.8,,Otros,"terramaster, rack, para, de, kit, u4/u8/u12",https://starcenter.com.uy/uploads/products/2755-915808331.jpg,,,,,,,,Sin Marca
,,CK010,CARGADOR HUAWEI SUPERCHARGE PARA AUTO,,,,"Descripción:
- Salida 4.5V5A 22.5W SuperCharge
- Cuerpo de plástico con 2 salidas USB-A
- Compatible con 9V2A, 5V2A & 5V1A","Descripción:
- Salida 4.5V5A 22.5W SuperCharge
- Cuerpo de plástico con 2 salidas USB-A
- Compatible con 9V2A, 5V2A & 5V1A",,,,14.0,,,14.7,,Otros,"&, 22.5w, 5v2a, de, 4.5v5a, supercharge, compatible, auto, -, plástico, salidas, salida, cuerpo, huawei, cargador, para, 5v1a, descripción:, 9v2a,, usb-a, con, 2","https://starcenter.com.uy/uploads/products/2758-66902424.jpg, https://starcenter.com.uy/uploads/products/2758-1285980253.jpg, https://starcenter.com.uy/uploads/products/2758-1285980253.jpg",https://starcenter.com.uy/uploads/products/2758-1285980253.jpg,,,,,,,Sin Marca
,,964995,MARCADOR PERMANENTE BIC FINO CON GRIP AZUL BOX X12U,,,,,,,,,310.0,,,12.26,,Otros,"bic, con, grip, marcador, fino, permanente, box, azul, x12u",https://starcenter.com.uy/uploads/products/2775-1044580675.jpg,,,,,,,,Sin Marca
,,966458,MARCADOR PERMANENTE BIC FINO CON GRIP NEGRO BOX X12U,,,,,,,,,4788.0,,,12.26,,Otros,"bic, con, grip, marcador, fino, permanente, negro, box, x12u",https://starcenter.com.uy/uploads/products/2776-1825372069.jpg,,,,,,,,Sin Marca
,,904212,MARCADOR BIC PERMANENTE AZUL BLISTER X1,,,,,,,,,11743.0,,,1.66,,Otros,"bic, blister, marcador, x1, permanente, azul",https://starcenter.com.uy/uploads/products/2781-115211987.jpg,,,,,,,,Sin Marca
,,904213,MARCADOR PERMANENTE BIC 2000 PUNTA CÓNICA NEGRO BLISTER X1U,,,,,,,,,4136.0,,,1.66,,Otros,"cónica, x1u, bic, blister, marcador, permanente, 2000, punta, negro",https://starcenter.com.uy/uploads/products/2782-505594113.jpg,,,,,,,,Sin Marca
,,904204,MARCADOR BIC PIZARRA BR NEGRO BLISTER X1,,,,,,,,,218.0,,,1.92,,Otros,"br, bic, blister, marcador, pizarra, negro, x1",https://starcenter.com.uy/uploads/products/2794-517198620.jpg,,,,,,,,Sin Marca
,,904205,MARCADOR BIC PIZARRA BR AZUL BLISTER X1,,,,,,,,,4536.0,,,1.92,,Otros,"br, bic, blister, marcador, pizarra, x1, azul","https://starcenter.com.uy/uploads/products/2795-1980097526.png, https://starcenter.com.uy/uploads/products/2795-927552578.jpg, https://starcenter.com.uy/uploads/products/2795-927552578.jpg",https://starcenter.com.uy/uploads/products/2795-927552578.jpg,,,,,,,Sin Marca
,,904206,MARCADOR BIC PIZARRA BR ROJO BLISTER X1,,,,,,,,,1113.0,,,1.92,,Otros,"br, rojo, bic, blister, marcador, pizarra, x1",https://starcenter.com.uy/uploads/products/2796-1771806040.jpg,,,,,,,,Sin Marca
,,902391,AFEITADORA BIC SENSITIVE PO/L15P12,,,,,,,,,5554.0,,,4.53,,Otros,"sensitive, afeitadora, bic, po/l15p12",https://starcenter.com.uy/uploads/products/2797-1443339344.png,,,,,,,,Sin Marca
,,904377,AFEITADORA BIC SENSITIVE PO/L7P5,,,,,,,,,88.0,,,2.26,,Otros,"sensitive, afeitadora, bic, po/l7p5",https://starcenter.com.uy/uploads/products/2798-2047328222.png,,,,,,,,Sin Marca
