ID,Type,SKU,Name,Published,Is featured?,Visibility in catalog,Short description,Description,Tax status,Tax class,In stock?,Stock,Backorders allowed?,Sold individually?,Regular price,Sale price,Categories,Tags,Images,Gallery,Download limit,Download expiry days,Parent,Grouped products,Attributes,Default attributes,Brands
,,ARGAC0101,CARGADOR USB PARA AUTO ARGOM,,,,"Práctico conector para recargar dispositivos, diseño compacto e liviano, compatible con los tomacorrientes de la mayoría de los vehículos, fusible inc...","Práctico conector para recargar dispositivos, diseño compacto e liviano, compatible con los tomacorrientes de la mayoría de los vehículos, fusible incorporado para proteger los dispositivos conectados.

Especificaciones

Puerto USB 2.0 1-Puerto 1000mA (1A)
Voltaje de alimentación: 12-24 V DC
Voltaje de salida: 5V
Dimensión (mm): 44x25x25
Indicador LED de conexión
",,,,355.0,,,2.39,,Otros,"salida:, e, diseño, especificaciones, v, puerto, 1000ma, dispositivos,, los, de, usb, compatible, voltaje, auto, compacto, 2.0, 5v, recargar, (1a), práctico, conector, alimentación:, liviano,, 1-puerto, fusible, dimensión, cargador, dc, vehículos,, conexión, para, incorporado, led, indicador, la, 44x25x25, mayoría, (mm):, dispositivos, 12-24, con, argom, conectados., tomacorrientes, proteger",https://starcenter.com.uy/uploads/products/25-1444336799.jpg,,,,,,,,Argom
,,ARGAC1222,MOUSE PAD C/GEL ARGOM,,,,"El Mouse Pad de Gel 360 con diseño ergonómico ofrece el mejor soporte para su muñeca. 
El Pad Ergonómico con soporte de gel para el brazo ofrece una p...","El Mouse Pad de Gel 360 con diseño ergonómico ofrece el mejor soporte para su muñeca. 
El Pad Ergonómico con soporte de gel para el brazo ofrece una posición confortable para el trabajo. 
Este pad esta hecho de tela Lycra elástica, gel indeformable y cuenta con una base de vinyl PU antideslizante. 
",,,,351.0,,,7.35,,Accesorios de Computadora,"antideslizante., ergonómico, su, diseño, mouse, elástica,, de, soporte, hecho, y, pu, base, c/gel, trabajo., gel, brazo, posición, mejor, pad, confortable, muñeca., el, esta, una, para, este, cuenta, ofrece, tela, con, 360, argom, lycra, indeformable, vinyl",https://starcenter.com.uy/uploads/products/29-1444336798.jpg,,,,,,,,Argom
,,ARGAC1233G,MOUSE PAD ARGOM ESMERALDA GREEN,,,,"Impreso en una cubierta duradera de paño, la base está hecha de una superficie antideslizante que mantiene la almohadilla en su sitio. Disponible en t...","Impreso en una cubierta duradera de paño, la base está hecha de una superficie antideslizante que mantiene la almohadilla en su sitio. Disponible en tres llamativos colores: Verde Esmeralda, Azul Zafiro y Rojo Rubí.",,,,222.0,,,1.37,,Accesorios de Computadora,"su, en, superficie, mantiene, duradera, mouse, cubierta, colores:, llamativos, de, azul, y, base, antideslizante, disponible, impreso, pad, tres, esmeralda, verde, una, rojo, zafiro, que, la, paño,, esmeralda,, sitio., almohadilla, argom, rubí., está, green, hecha",https://starcenter.com.uy/uploads/products/30-1444336781.jpg,,,,,,,,Argom
,,ARGAC1233R,MOUSE PAD RUBY RED ARGOM,,,,"Impreso en una cubierta duradera de paño, la base está hecha de una superficie antideslizante que mantiene la almohadilla en su sitio. Disponible en t...","Impreso en una cubierta duradera de paño, la base está hecha de una superficie antideslizante que mantiene la almohadilla en su sitio. Disponible en tres llamativos colores: Verde Esmeralda, Azul Zafiro y Rojo Rubí.",,,,226.0,,,1.37,,Accesorios de Computadora,"su, en, superficie, mantiene, duradera, mouse, cubierta, colores:, llamativos, de, azul, y, red, base, antideslizante, disponible, ruby, impreso, pad, tres, verde, una, rojo, zafiro, que, la, paño,, esmeralda,, sitio., almohadilla, argom, rubí., está, hecha",https://starcenter.com.uy/uploads/products/31-1444336777.jpg,,,,,,,,Argom
,,ARGCB0034,CABLE ARGOM USB A MICRO 1M,,,,"Cable de 1 metro 2.0 con conector USB 2.0 en un extremo y conector micro USB en el otro.
Ideal para dispositivos portátiles compactos, permitiendo fác...","Cable de 1 metro 2.0 con conector USB 2.0 en un extremo y conector micro USB en el otro.
Ideal para dispositivos portátiles compactos, permitiendo fácilmente sincronizar y transferir datos o cargar el dispositivo a una velocidad de transferencia de hasta 480 Mbps.
",,,,413.0,,,1.66,,Cables,"velocidad, o, en, 480, de, portátiles, 1, usb, y, un, metro, a, 2.0, permitiendo, cargar, datos, hasta, conector, sincronizar, compactos,, 1m, el, una, ideal, otro., extremo, para, dispositivos, mbps., transferencia, con, argom, fácilmente, micro, transferir, cable, dispositivo","https://starcenter.com.uy/uploads/products/43-1444336770.jpg, https://starcenter.com.uy/uploads/products/43-72-1444336771.jpg, https://starcenter.com.uy/uploads/products/43-73-1444336772.jpg, https://starcenter.com.uy/uploads/products/43-74-1444336773.jpg, https://starcenter.com.uy/uploads/products/43-75-1444336774.jpg, https://starcenter.com.uy/uploads/products/43-72-1444336771.jpg, https://starcenter.com.uy/uploads/products/43-73-1444336772.jpg, https://starcenter.com.uy/uploads/products/43-74-1444336773.jpg, https://starcenter.com.uy/uploads/products/43-75-1444336774.jpg","https://starcenter.com.uy/uploads/products/43-72-1444336771.jpg, https://starcenter.com.uy/uploads/products/43-73-1444336772.jpg, https://starcenter.com.uy/uploads/products/43-74-1444336773.jpg, https://starcenter.com.uy/uploads/products/43-75-1444336774.jpg",,,,,,,Argom
,,ARGCB0035,"CABLE ARGOM AUDIO 3,5MM A 3,5MM",,,,"Compatible con la mayoría de dispositivos de audio, incluyendo consolas de videojuegos, teléfonos celulares, tabletas, ordenadores portátiles, conecto...","Compatible con la mayoría de dispositivos de audio, incluyendo consolas de videojuegos, teléfonos celulares, tabletas, ordenadores portátiles, conector auxiliar para vehículo, iPod, MP3/MP4, reproductores multimedia, sistemas de altavoces, etc.

ESPECIFICACIONES

Cable de 6 pies / 1.5 metros con conectores estíreo de 3.5 mm Macho y Hembra en los extremos.
3.5 mm 4 conductores (3 anillos negros) Audio Estíreo + Micrófono.",,,,117.0,,,1.56,,Cables,"micrófono., 4, consolas, portátiles,, en, especificaciones, ordenadores, celulares,, de, mm, los, anillos, /, y, etc., compatible, conectores, ipod,, a, reproductores, altavoces,, (3, vehículo,, videojuegos,, macho, pies, auxiliar, conector, negros), extremos., hembra, metros, audio,, sistemas, 3.5, estíreo, 3,5mm, para, +, mp3/mp4,, la, multimedia,, 6, mayoría, conductores, dispositivos, con, audio, tabletas,, teléfonos, argom, incluyendo, cable, 1.5","https://starcenter.com.uy/uploads/products/44-1444336765.jpg, https://starcenter.com.uy/uploads/products/44-69-1444336766.jpg, https://starcenter.com.uy/uploads/products/44-70-1444336768.jpg, https://starcenter.com.uy/uploads/products/44-71-1444336768.jpg, https://starcenter.com.uy/uploads/products/44-69-1444336766.jpg, https://starcenter.com.uy/uploads/products/44-70-1444336768.jpg, https://starcenter.com.uy/uploads/products/44-71-1444336768.jpg","https://starcenter.com.uy/uploads/products/44-69-1444336766.jpg, https://starcenter.com.uy/uploads/products/44-70-1444336768.jpg, https://starcenter.com.uy/uploads/products/44-71-1444336768.jpg",,,,,,,Argom
,,ARGCB0037,CABLE ARGOM LIGHTNING PARA IPHONE,,,,"Cable de 3 pies/1 metro con conectores estéreo de 3,5 mm en los extremos.
Compatible con la mayoría de dispositivos de audio, incluyendo consolas de v...","Cable de 3 pies/1 metro con conectores estéreo de 3,5 mm en los extremos.
Compatible con la mayoría de dispositivos de audio, incluyendo consolas de videojuegos, teléfonos celulares, tabletas, ordenadores portátiles, conector auxiliar para vehículo, iPod, MP3/MP4 reproductores multimedia, sistemas de altavoces, etc.
",,,,2808.0,,,1.96,,Cables,"consolas, portátiles,, en, ordenadores, mm, de, los, celulares,, etc., compatible, conectores, ipod,, metro, reproductores, altavoces,, vehículo,, 3,5, videojuegos,, pies/1, auxiliar, conector, estéreo, extremos., iphone, audio,, sistemas, lightning, para, la, multimedia,, mp3/mp4, mayoría, 3, dispositivos, con, tabletas,, teléfonos, argom, incluyendo, cable","https://starcenter.com.uy/uploads/products/45-1107099379.jpg, https://starcenter.com.uy/uploads/products/45-467367813.jpg, https://starcenter.com.uy/uploads/products/45-467367813.jpg",https://starcenter.com.uy/uploads/products/45-467367813.jpg,,,,,,,Argom
,,ARGCB1875,CABLE ARGOM HDMI 3MTS,,,,"Cable Digital de Alta definición para Audio/Video
Transmite Alta definición a 480p/720p/1080p y 3D 
Version 1.4.
","Cable Digital de Alta definición para Audio/Video
Transmite Alta definición a 480p/720p/1080p y 3D 
Version 1.4.
",,,,77.0,,,5.09,,Cables,"3mts, audio/video, definición, a, 1.4., y, transmite, para, digital, 3d, argom, version, alta, de, hdmi, cable, 480p/720p/1080p",https://starcenter.com.uy/uploads/products/48-1444336789.jpg,,,,,,,,Argom
,,ARGHS0525B,AURICULARES 525 NEGRO ARGOM,,,,Ergonómicamente diseñado para ajustarse a las afueras del canal auditivo. Los auriculares Argom proporcionan un ajuste cómodo para horas de placer aud...,"Ergonómicamente diseñado para ajustarse a las afueras del canal auditivo. Los auriculares Argom proporcionan un ajuste cómodo para horas de placer auditivo.

ESPECIFICACIONES

Compatibles para iPod, iPhone, Blackberry o portable CD, DVD or MP3/MP4 player.
Presentan un diseño liviano y ergonómico con cancelación de ruido y sonido envolvente.",,,,110.0,,,3.03,,Otros,"ajustarse, ergonómico, placer, o, diseño, especificaciones, envolvente., blackberry, negro, diseñado, los, cómodo, auditivo., de, or, liviano, y, un, ipod,, a, sonido, player., ergonómicamente, dvd, ajuste, auriculares, para, iphone,, cancelación, afueras, ruido, portable, cd,, del, proporcionan, mp3/mp4, compatibles, canal, 525, con, argom, horas, presentan, las",https://starcenter.com.uy/uploads/products/54-1332791718.jpg,,,,,,,,Argom
,,ARGHS0525L,AURICULARES 525 AZUL ARGOM,,,,Ergonómicamente diseñado para ajustarse a las afueras del canal auditivo. Los auriculares Argom proporcionan un ajuste cómodo para horas de placer aud...,"Ergonómicamente diseñado para ajustarse a las afueras del canal auditivo. Los auriculares Argom proporcionan un ajuste cómodo para horas de placer auditivo.

ESPECIFICACIONES

Compatibles para iPod, iPhone, Blackberry o portable CD, DVD or MP3/MP4 player.
Presentan un diseño liviano y ergonómico con cancelación de ruido y sonido envolvente.

",,,,150.0,,,3.03,,Otros,"ajustarse, ergonómico, placer, o, diseño, especificaciones, envolvente., blackberry, diseñado, los, cómodo, de, auditivo., or, azul, liviano, y, un, ipod,, a, sonido, player., ergonómicamente, dvd, ajuste, auriculares, para, iphone,, cancelación, afueras, ruido, portable, cd,, del, proporcionan, mp3/mp4, compatibles, canal, 525, con, argom, horas, presentan, las",https://starcenter.com.uy/uploads/products/55-81214298.jpg,,,,,,,,Argom
,,ARGHS0525R,AURICULARES 525 RED ARGOM,,,,Ergonomicamente disenado para ajustarse a las afueras del canal auditivo. Los auriculares ArgomTech proporcionan un ajuste comodo para horas de placer...,"Ergonomicamente disenado para ajustarse a las afueras del canal auditivo. Los auriculares ArgomTech proporcionan un ajuste comodo para horas de placer auditivo.

ESPECIFICACIONES

Compatibles para iPod, iPhone, Blackberry o portable CD, DVD or MP3/MP4 player.
Presentan un diseño liviano y ergonómico con cancelación de ruido y sonido envolvente.

",,,,145.0,,,3.52,,Otros,"ajustarse, ergonómico, comodo, placer, o, diseño, especificaciones, envolvente., blackberry, los, de, or, auditivo., liviano, y, argomtech, red, un, ipod,, ergonomicamente, a, sonido, player., dvd, ajuste, auriculares, para, iphone,, cancelación, afueras, ruido, portable, cd,, del, proporcionan, mp3/mp4, compatibles, canal, 525, con, disenado, argom, horas, presentan, las",https://starcenter.com.uy/uploads/products/56-119427619.jpg,,,,,,,,Argom
,,ARGHS0525W,AURICULARES 525 BLANCO ARGOM,,,,Ergonómicamente diseñado para ajustarse a las afueras del canal auditivo. Los auriculares Argom proporcionan un ajuste cómodo para horas de placer aud...,"Ergonómicamente diseñado para ajustarse a las afueras del canal auditivo. Los auriculares Argom proporcionan un ajuste cómodo para horas de placer auditivo.

ESPECIFICACIONES

Compatibles para iPod, iPhone, Blackberry o portable CD, DVD or MP3/MP4 player.
Presentan un diseño liviano y ergonómico con cancelación de ruido y sonido envolvente.
",,,,21.0,,,3.03,,Otros,"ajustarse, ergonómico, blanco, placer, o, diseño, especificaciones, envolvente., blackberry, diseñado, los, cómodo, de, auditivo., or, liviano, y, un, ipod,, a, sonido, player., ergonómicamente, dvd, ajuste, auriculares, para, iphone,, cancelación, afueras, ruido, portable, cd,, del, proporcionan, mp3/mp4, compatibles, canal, 525, con, argom, horas, presentan, las",https://starcenter.com.uy/uploads/products/57-1438601643.jpg,,,,,,,,Argom
,,ARGHS0595B,AURICULAR DIVINE SOUND NEGRO ARGOM,,,,"El nuevo Audífono de ArgomTech te ofrece la mejor experiencia de audio con excelente sonido. Ofrece graves profundos, voces naturales y agudos preciso...","El nuevo Audífono de ArgomTech te ofrece la mejor experiencia de audio con excelente sonido. Ofrece graves profundos, voces naturales y agudos precisos, y también incluye tres tamaños de almohadillas de gel de silicona para un ajuste seguro y cómodo. Viene además con micrófono y botón para selección de llamada telefónica.

ESPECIFICACIONES

Tipo de Conector: Conector dorado de 4 polos 3.5mm 
Micrófono y botón selector de llamadas telefónicas 
Longitud del cable: 1.2m (4 feet) 
Membrana: 10mm Diameter 
Impedancia: 16Ohm ± 15% 
Respuesta de Frecuencia: 20Hz- 20KHz 
Sensibilidad: 105dB ± 3dB
Incluye 3 medidas de adaptadores de silicona para el oído",,,,320.0,,,7.05,,Cables,"(4, diameter, micrófono, y, tipo, 16ohm, nuevo, medidas, sensibilidad:, tres, 15%, el, 20hz-, graves, agudos, 3db, botón, con, 4, selector, especificaciones, almohadillas, adaptadores, frecuencia:, respuesta, oído, ±, seguro, membrana:, mejor, profundos,, divine, impedancia:, para, la, auricular, 1.2m, 10mm, 20khz, conector:, negro, de, sound, audífono, experiencia, dorado, gel, incluye, sonido., del, 105db, te, 3, naturales, además, audio, argom, 3.5mm, viene, selección, llamada, precisos,, argomtech, polos, un, silicona, cable:, feet), conector, tamaños, ajuste, llamadas, excelente, cómodo., ofrece, voces, también, longitud, telefónica., telefónicas",https://starcenter.com.uy/uploads/products/58-1444336775.jpg,,,,,,,,Argom
,,ARGHS0595K,AURICULAR DIVINE SOUND ROSA ARGOM,,,,"El nuevo Audífono de ArgomTech te ofrece la mejor experiencia de audio con excelente sonido. Ofrece graves profundos, voces naturales y agudos preciso...","El nuevo Audífono de ArgomTech te ofrece la mejor experiencia de audio con excelente sonido. Ofrece graves profundos, voces naturales y agudos precisos, y también incluye tres tamaños de almohadillas de gel de silicona para un ajuste seguro y cómodo. Viene además con micrófono y botón para selección de llamada telefónica.

ESPECIFICACIONES

Tipo de Conector: Conector dorado de 4 polos 3.5mm 
Micrófono y botón selector de llamadas telefónicas 
Longitud del cable: 1.2m (4 feet) 
Membrana: 10mm Diameter 
Impedancia: 16Ohm ± 15% 
Respuesta de Frecuencia: 20Hz- 20KHz 
Sensibilidad: 105dB ± 3dB
Incluye 3 medidas de adaptadores de silicona para el oído",,,,638.0,,,7.05,,Cables,"(4, diameter, micrófono, y, tipo, 16ohm, nuevo, medidas, sensibilidad:, tres, 15%, el, 20hz-, graves, agudos, 3db, botón, con, 4, selector, especificaciones, almohadillas, adaptadores, frecuencia:, respuesta, oído, ±, seguro, membrana:, mejor, profundos,, divine, impedancia:, para, la, auricular, 1.2m, 10mm, 20khz, conector:, de, sound, audífono, experiencia, dorado, gel, incluye, sonido., del, 105db, te, 3, naturales, además, audio, argom, 3.5mm, viene, selección, llamada, precisos,, argomtech, polos, un, silicona, cable:, feet), conector, tamaños, ajuste, rosa, llamadas, excelente, cómodo., ofrece, voces, también, longitud, telefónica., telefónicas",https://starcenter.com.uy/uploads/products/59-1444336746.jpg,,,,,,,,Argom
,,ARGKB7414,TECLADO BÁSICO  ARGOM,,,,"El teclado básico Argom es perfecto para todas sus necesidades de tipeo estándar, con garantía de calidad y durabilidad. Solo tiene que conectar y uti...","El teclado básico Argom es perfecto para todas sus necesidades de tipeo estándar, con garantía de calidad y durabilidad. Solo tiene que conectar y utilizar: no se pierde tiempo con complicada configuración o instalación. El diseño delgado lo hace fácil de transportar y usar en cualquier lugar. Un estilo elegante y de color negro va a mejorar su espacio de trabajo en su casa u oficina.

ESPECIFICACIONES

Diseño ergonómico, atractivo y confortable.
Tiempo de vida de las teclas: 10 millones de pulsos.
Configuración automática, conectarlo para comenzar a usarlo.
Plástico de larga duración y resistente a derrames de agua.
Teclas suave al tacto para una digitación uniforme y precisa.
Patas traseras ajustables para inclinación adecuada.
Compatibilidad con W98 / ME / 2000 / XP / Vista / Win7/Win8.
Presión teclas: 45 ±7g
Alimentación: ±5V 
Interface: USB
",,,,51.0,,,6.23,,Otros,"ajustables, patas, diseño, tipeo, ±7g, espacio, digitación, y, /, xp, usar, trabajo, a, agua., pulsos., sus, w98, tacto, alimentación:, ±5v, oficina., comenzar, elegante, el, teclado, lo, duración, es, que, pierde, cualquier, con, 45, color, uniforme, tiempo, teclas, estándar,, o, en, especificaciones, conectarlo, usarlo., usb, me, tiene, casa, conectar, 2000, vida, teclas:, instalación., para, calidad, estilo, va, mejorar, automática,, ergonómico,, lugar., durabilidad., no, compatibilidad, su, adecuada., negro, de, hace, atractivo, plástico, necesidades, larga, una, solo, vista, derrames, perfecto, presión, fácil, suave, transportar, argom, inclinación, se, interface:, configuración, delgado, precisa., complicada, todas, básico, un, millones, resistente, traseras, garantía, confortable., 10, al, u, utilizar:, win7/win8., las",https://starcenter.com.uy/uploads/products/70-1444336763.jpg,,,,,,,,Argom
,,ARGKB7436,TECLADO Y MOUSE INALAMBRICO ARGOM,,,,"El Teclado con Ratón Inalámbrico Combo en Español es perfecto para todas sus necesidades de escritura, contando además con garantía, calidad y durabil...","El Teclado con Ratón Inalámbrico Combo en Español es perfecto para todas sus necesidades de escritura, contando además con garantía, calidad y durabilidad. Disfrute del ratón óptico con conector USB y rueda de alta precisión con 1000 DPI. Solo tiene que conectarlos y utilizarlos: no es necesaria una complicada configuración o instalación. Su diseño de bajo perfil lo hace fácil de transportar y usar en cualquier lugar, mientras que su estilo elegante y color negro lo harán lucir apropiado en su escritorio en casa o la oficina.

Especificaciones

Teclado con Ratón Inalámbrico Combo en Español de 2.4Ghz
10 metros de rango
Incluye un pequeño receptor NANO con código inteligente
1000 DPI
Después de 10 minutos, va a modo de espera para ahorrar energía
Ajuste automático de frecuencia
5 millones de clics de vida útil
16 canales, uno a la vez
Medida del Tablero: 385*111*12mm
Medida del Mouse: 98* 53*22mm",,,,99.0,,,17.15,,Accesorios de Computadora,"diseño, contando, inalámbrico, y, usar, necesaria, a, precisión, sus, oficina., frecuencia, elegante, rango, el, teclado, lo, óptico, es, modo, que, garantía,, cualquier, rueda, con, lugar,, alta, color, perfil, o, en, canales,, especificaciones, 53*22mm, usb, lucir, tiene, casa, disfrute, después, vida, clics, vez, instalación., harán, para, minutos,, medida, calidad, estilo, mouse:, la, energía, va, automático, metros, durabilidad., ahorrar, escritura,, utilizarlos:, no, su, mouse, código, negro, de, útil, 98*, 5, hace, incluye, escritorio, espera, necesidades, una, solo, del, 385*111*12mm, perfecto, 16, ratón, fácil, además, transportar, argom, 2.4ghz, configuración, nano, 1000, dpi., complicada, inteligente, combo, tablero:, bajo, español, todas, un, conectarlos, millones, conector, dpi, pequeño, ajuste, 10, mientras, uno, inalambrico, receptor, apropiado",https://starcenter.com.uy/uploads/products/71-1990834092.jpg,,,,,,,,Argom
,,ARGKB7805,TECLADO MULTIMEDIA ARGOM,,,,"Disfruta de escribir en un teclado de buen diseño con plenitud y facilidad. Con interfaz USB, el ARG-KB-7805 le ofrece la mejor experiencia frente a s...","Disfruta de escribir en un teclado de buen diseño con plenitud y facilidad. Con interfaz USB, el ARG-KB-7805 le ofrece la mejor experiencia frente a su PC o portátil. Su estructura confortable de tecla ofrece máximo confort al escribir, y sus nueve teclas de acceso rápido hacen que sea fácil de controlar su música favorita o un vídeo o navegar en el internet.

ESPECIFICACIONES

Diseño atractivo y confortable 
Tiempo de vida de las teclas: 10 millones de pulsos
9 Teclas multimedia de acceso rápido 
Presión Teclas: 45 ±7g
Alimentación: ±5V 
Interface: USB
Compatibilidad con W98 / ME / 2000 / XP / Vista / Win7/Win8
",,,,2.0,,,6.76,,Otros,"9, estructura, compatibilidad, o, su, escribir, en, diseño, arg-kb-7805, acceso, vídeo, rápido, especificaciones, ±7g, portátil., de, usb, y, facilidad., /, xp, win7/win8, música, un, máximo, controlar, a, experiencia, disfruta, me, millones, hacen, nueve, sus, w98, atractivo, alimentación:, ±5v, 2000, plenitud, usb,, tecla, mejor, confortable, vida, teclas:, el, teclado, frente, escribir,, internet., 10, buen, que, la, pc, sea, interfaz, navegar, vista, ofrece, multimedia, pulsos, confort, presión, fácil, favorita, con, al, 45, argom, interface:, tiempo, le, las, teclas","https://starcenter.com.uy/uploads/products/72-1444336718.jpg, https://starcenter.com.uy/uploads/products/72-56-1444336719.jpg, https://starcenter.com.uy/uploads/products/72-57-1444336720.jpg, https://starcenter.com.uy/uploads/products/72-58-1444336722.jpg, https://starcenter.com.uy/uploads/products/72-59-1444336724.jpg, https://starcenter.com.uy/uploads/products/72-56-1444336719.jpg, https://starcenter.com.uy/uploads/products/72-57-1444336720.jpg, https://starcenter.com.uy/uploads/products/72-58-1444336722.jpg, https://starcenter.com.uy/uploads/products/72-59-1444336724.jpg","https://starcenter.com.uy/uploads/products/72-56-1444336719.jpg, https://starcenter.com.uy/uploads/products/72-57-1444336720.jpg, https://starcenter.com.uy/uploads/products/72-58-1444336722.jpg, https://starcenter.com.uy/uploads/products/72-59-1444336724.jpg",,,,,,,Argom
,,ARGKL5001,LINGA 1.8 M ARGOM,,,,"Enrollas el cable alrededor de un objeto inamovible y el candado a través del bucle. 
Asegúrese antes de comenzar que la combinación esté en 0-0-0-0 (...","Enrollas el cable alrededor de un objeto inamovible y el candado a través del bucle. 
Asegúrese antes de comenzar que la combinación esté en 0-0-0-0 (código de fábrica).
Ir al modo de reinicio: aprieta el botón en el costado de la combinación con un lápiz.
Gira las ruedas hasta establecer su combinación secreta personal. 
Suelta el botón del costado de la combinación y tu código secreto quedará establecido. 
",,,,27.0,,,8.82,,Cables,"tu, su, en, (código, secreta, combinación, inamovible, código, de, y, un, a, esté, establecer, hasta, través, enrollas, lápiz., comenzar, 0-0-0-0, 1.8, reinicio:, el, secreto, quedará, suelta, ruedas, ir, bucle., modo, fábrica)., que, costado, candado, la, botón, gira, del, m, aprieta, antes, personal., al, con, argom, alrededor, asegúrese, linga, cable, objeto, establecido., las",https://starcenter.com.uy/uploads/products/73-1444336761.jpg,,,,,,,,Argom
,,ARGMS0014B,MOUSE USB 3D BLACK ARGOM,,,,"3D 3 botones y cable.
Sensor óptico de 800DPI.
Rueda scroll ABS. 
Tamaño 95 x 50 x 33 mm. 
100mA max-5V.
W98/ME/2000/XP/Vista/Win7/Win8
","3D 3 botones y cable.
Sensor óptico de 800DPI.
Rueda scroll ABS. 
Tamaño 95 x 50 x 33 mm. 
100mA max-5V.
W98/ME/2000/XP/Vista/Win7/Win8
",,,,1.0,,,3.13,,Cables,"abs., 3d, mouse, x, de, 33, usb, y, black, max-5v., w98/me/2000/xp/vista/win7/win8, cable., sensor, óptico, tamaño, 95, 800dpi., 3, scroll, 50, 100ma, rueda, argom, mm., botones",https://starcenter.com.uy/uploads/products/74-1444336760.jpg,,,,,,,,Argom
,,ARGMS0014L,MOUSE USB 3D BLUE ARGOM,,,,"3D 3 botones y cable.
Sensor óptico de 800DPI.
Rueda scroll ABS. 
Tamaño 95 x 50 x 33 mm. 
100mA max-5V.
W98/ME/2000/XP/Vista/Win7/Win8
","3D 3 botones y cable.
Sensor óptico de 800DPI.
Rueda scroll ABS. 
Tamaño 95 x 50 x 33 mm. 
100mA max-5V.
W98/ME/2000/XP/Vista/Win7/Win8
",,,,6.0,,,3.13,,Cables,"abs., 3d, mouse, x, de, 33, usb, y, max-5v., w98/me/2000/xp/vista/win7/win8, cable., blue, sensor, óptico, tamaño, 95, 800dpi., 3, scroll, 50, 100ma, rueda, argom, mm., botones",https://starcenter.com.uy/uploads/products/75-1444336757.jpg,,,,,,,,Argom
